{
  "id": "d3c3d8c3-cc3e-4e2a-8c9d-572bafc0c0a1",
  "user_id": "0c9d1bc1-7b1a-41fb-84f2-9e2a1b01b6a4",
  "title": "Prophecy Diary — A Sci-Fi Novella",
  "creation_type": "novel_project",
  "status": "draft",
  "language": "en",
  "tags": ["sci-fi"],
  "meta": {
    "type": "novel_project",
    "genre": "Sci-Fi",
    "target_words": 20000,
    "audience": "YA"
  },
  "sections": [
    { "title": "Chapter 1", "kind": "chapter", "order_index": 0, "body": "…" }
  ],
  "assets": [],
  "idea_ids": [],
  "goal_ids": [],
  "created_at": "2025-11-10T03:07:00Z",
  "updated_at": "2025-11-10T03:07:00Z"
}

